<!--
  Copyright (C) 2009 STMicroelectronics

 This file is part of "Mind Compiler" is free software: you can redistribute 
 it and/or modify it under the terms of the GNU Lesser General Public License 
 as published by the Free Software Foundation, either version 3 of the 
 License, or (at your option) any later version.

 This program is distributed in the hope that it will be useful, but WITHOUT 
 ANY WARRANTY; without even the implied warranty of MERCHANTABILITY or FITNESS
 FOR A PARTICULAR PURPOSE.  See the GNU Lesser General Public License for more
 details.

 You should have received a copy of the GNU Lesser General Public License
 along with this program.  If not, see <http://www.gnu.org/licenses/>.

 Contact: mind@ow2.org

 Authors: Matthieu Leclercq
 Contributors: 

 -->

<!-- *********************************************************************** -->
<!-- Basic AST structure                                                     -->
<!-- *********************************************************************** -->

<?add ast="testset" itf="org.ow2.mind.test.ast.TestSet" ?>
<?add ast="test"    itf="org.ow2.mind.test.ast.Test" ?>
<?add ast="config"  itf="org.ow2.mind.test.ast.Config" ?>
<?add ast="command" itf="org.ow2.mind.test.ast.Command" ?>
<?add ast="mindc"   itf="org.ow2.mind.test.ast.Mindc" ?>
<?map ast="mindc"   type="command" ?>


<!-- *********************************************************************** -->
<!-- Node grammar                                                            -->
<!-- *********************************************************************** -->

<!ELEMENT testset (config*, test*) >
<!ATTLIST testset
  name CDATA #REQUIRED
  nbJobs CDATA #IMPLIED
  runner CDATA #IMPLIED
>

<!ELEMENT test (config*) >
<!ATTLIST test
  name CDATA #REQUIRED
  adl CDATA #IMPLIED
  configRefs CDATA #IMPLIED
>

<!ELEMENT config ((command|mindc)*) >
<!ATTLIST config
  name CDATA #REQUIRED
  targetDescriptor CDATA #IMPLIED
>

<!ELEMENT command (#PCDATA) >
<!ATTLIST command
  dir CDATA #IMPLIED
  command CDATA #IMPLIED
>

<!ELEMENT mindc (#PCDATA) >
<!ATTLIST mindc
  dir      CDATA #IMPLIED
  command  CDATA #IMPLIED
  adl      CDATA #IMPLIED
  targetDescriptor CDATA #IMPLIED
  cFlags CDATA #IMPLIED
  ldFlags CDATA #IMPLIED
  execName CDATA #IMPLIED
>

